{
  "historySchemaVersion": "1",
  "record": "frozen-independent-holdout-evaluation",
  "branchStrategy": {
    "kind": "stacked",
    "baseBranch": "agent/independent-holdout-validation",
    "headBranch": "agent/holdout-generalization-fixes"
  },
  "baseCommits": {
    "validationBase": "0231d6fe779203a92469099b90d446fafe67b064",
    "matcherV2Implementation": "df45e021bc4d2b3c2fd0155bf75ae3967ee80b0d",
    "matcherV3Implementation": "29ea23e0e9b0b85269d3eaaa52ccf3c7a91da30b",
    "matcherV3SourceTreeSha256": "4a6b69ed50a96334fbcf949eda7a044d14f4d9c7405e7641567ff84d604f6486"
  },
  "matcherAlgorithmVersion": "sarifregress/matcher/v3",
  "fingerprintAlgorithmVersions": [
    {
      "name": "derived-fingerprint",
      "version": "rule-path-context/v2"
    },
    {
      "name": "derived-fingerprint-compare",
      "version": "sarifregress/derived-fingerprint-compare/v2"
    },
    {
      "name": "embedded-snippet",
      "version": "embedded-snippet/v1"
    },
    {
      "name": "producer-fingerprint-common",
      "version": "sarifregress/producer-fingerprint-common-version/v1"
    }
  ],
  "matchingEvidenceAlgorithmVersions": [
    {
      "name": "configured-uri-base",
      "version": "sarifregress/configured-uri-base/v1"
    },
    {
      "name": "context-evidence",
      "version": "sarifregress/context-evidence/v2"
    },
    {
      "name": "evidence-occurrence",
      "version": "sarifregress/evidence-occurrence/v1"
    }
  ],
  "configurationSchemaVersion": "1",
  "outputSchemaVersion": "1",
  "validationSchemaVersions": {
    "sarifRegressHoldout": "2",
    "sarifMultitoolBaseline": "1",
    "comparisonSummary": "2",
    "v2ToV3Delta": "1",
    "crossPlatformAttestation": "2"
  },
  "dotnetSdkVersion": "10.0.302",
  "multitoolExactVersion": "5.5.0",
  "holdout": {
    "manifestSha256": "b9cf6325e2758889449aa021b5b45b3636e17a0dcf65d3c7dba215c2964fe379",
    "groundTruthUnits": 99,
    "labelledRelationships": 75,
    "labelSha256": {
      "gitleaks": "1f17cc8e0eab4e94c70519817c42430a3344c42bd55c2ecd044d1d5f4b84b026",
      "pmd": "ef362ac8d1c682b554628192f1c4f9556d1824551fb399d5fabe0ce2dba60cc6",
      "semgrep": "17e58ff2b4197816a9d997df80dfb507ff30faa170a23128a3bc887e894268d7"
    }
  },
  "qualityThresholds": {
    "aggregatePrecision": 0.95,
    "aggregateRecall": 0.9,
    "perProducerPrecision": 0.95,
    "perProducerRecall": 0.8,
    "maximumIncorrectAmbiguityMatches": 0
  },
  "metrics": {
    "aggregate": {
      "truePositives": 50,
      "falsePositives": 0,
      "falseNegatives": 25,
      "precision": 1.0,
      "recall": 0.666667,
      "f1": 0.8
    },
    "perProducer": [
      {
        "producerId": "gitleaks",
        "metrics": {
          "truePositives": 25,
          "falsePositives": 0,
          "falseNegatives": 0,
          "precision": 1.0,
          "recall": 1.0,
          "f1": 1.0
        }
      },
      {
        "producerId": "pmd",
        "metrics": {
          "truePositives": 0,
          "falsePositives": 0,
          "falseNegatives": 25,
          "precision": 1.0,
          "recall": 0.0,
          "f1": 0.0
        }
      },
      {
        "producerId": "semgrep",
        "metrics": {
          "truePositives": 25,
          "falsePositives": 0,
          "falseNegatives": 0,
          "precision": 1.0,
          "recall": 1.0,
          "f1": 1.0
        }
      }
    ]
  },
  "lifecycle": {
    "new": {
      "expected": 9,
      "correct": 9,
      "incorrect": 0,
      "accuracy": 1.0
    },
    "resolved": {
      "expected": 9,
      "correct": 9,
      "incorrect": 0,
      "accuracy": 1.0
    }
  },
  "ambiguity": {
    "correctRefusals": 4,
    "incorrectAutoMatches": 0,
    "unexpectedRefusals": 0
  },
  "evaluationHealth": {
    "ingestionFailures": 0,
    "structuralFailures": 0,
    "classificationMismatches": 5,
    "changedDecisionsWithTrace": 64,
    "changedDecisionsWithoutTrace": 0
  },
  "delta": {
    "fixedRelationships": 59,
    "regressedRelationships": 0,
    "stillFailingRelationships": 32,
    "newlyIntroducedFalseMatches": 0
  },
  "reportHashes": {
    "sarifRegressHoldout": "c9411e318678412ae757739749a58a999aa0fc6640b6a76460b4b59ad083dd99",
    "sarifMultitoolBaseline": "edc58e16c85635ee3ffa7dddd454425230fe3f71f4020b80cb1baf7f20300aa2",
    "comparisonSummary": "4d8b79c467a26fd2f35d806e8ab8945fde0a8a48449edeb667ecdcd2c676784a",
    "v2ToV3Delta": "e75c5fd7855e4da55029a8f262d78ba2007f574092c2464085f870204a18afdb",
    "expectedChecksumManifest": "8ea45034a51c70de8de6bb05bad99729655d705a7fbec706800bfceb541b59f9",
    "crossPlatformAttestation": "1063dda897ee632e6c91cc6af8fa36dc91dc802ebd05141be657db7e5c0f0b50",
    "evaluationMetadata": "d9e88ba62142a23459ad86f5372b2e153e4727c3560662b8625a7a115d9006b7",
    "holdoutManifest": "b9cf6325e2758889449aa021b5b45b3636e17a0dcf65d3c7dba215c2964fe379",
    "matcherV2ChecksumManifest": "04ed4d840b20a5cd681ee25303d0488e32aeaef46007a765c7ad29fd2c702f1a",
    "matcherV2SarifRegressHoldout": "d53225fbafeda78048726d201b230c6c24f0f8f68348e827b096f754406110cf"
  },
  "releaseRecommendation": "blocked",
  "releaseReasons": [
    "recall-below-threshold",
    "per-producer-recall-below-threshold",
    "complete-label-graph-failed"
  ],
  "links": {
    "validationPullRequest": "https://github.com/ppcdaniel/sarif-regress/pull/8",
    "implementationPullRequest": "https://github.com/ppcdaniel/sarif-regress/pull/13",
    "umbrellaIssue": "https://github.com/ppcdaniel/sarif-regress/issues/12",
    "externalUriBaseIssue": "https://github.com/ppcdaniel/sarif-regress/issues/9",
    "contextCollisionIssue": "https://github.com/ppcdaniel/sarif-regress/issues/10",
    "sparseSarifIssue": "https://github.com/ppcdaniel/sarif-regress/issues/11",
    "bootstrapWorkflow": "https://github.com/ppcdaniel/sarif-regress/actions/runs/30698849989",
    "attestedRegenerationWorkflow": "https://github.com/ppcdaniel/sarif-regress/actions/runs/30699075579"
  },
  "immutability": {
    "holdoutLabelsChanged": false,
    "qualityThresholdsChanged": false,
    "difficultCasesRemoved": false,
    "producerSpecificProductLogicAdded": false
  }
}
